<?xml version="1.0" encoding="UTF-8" standalone="yes"?>
<!--
Copyright 2016 Goldman Sachs.
Licensed under the Apache License, Version 2.0 (the "License");
you may not use this file except in compliance with the License.
You may obtain a copy of the License at

  http://www.apache.org/licenses/LICENSE-2.0

Unless required by applicable law or agreed to in writing,
software distributed under the License is distributed on an
"AS IS" BASIS, WITHOUT WARRANTIES OR CONDITIONS OF ANY
KIND, either express or implied.  See the License for the
specific language governing permissions and limitations
under the License.
-->
<ManagedObject xmlns:xsi="http://www.w3.org/2001/XMLSchema-instance"
               xsi:noNamespaceSchemaLocation="../../../xsd/objectmanager.xsd">

    <Templates>interface,noki,qahabiwe,wunopi,tetahij,key,nuzikuzu,javeneruma
    </Templates>

    <PackageName>com.gs.fw.lilu.hos.domain.product</PackageName>
    <ImportPackageName>com.gs.fw.lilu.hos.domain.product.ZuquxuLOQOmawavi
    </ImportPackageName>

    <ClassName>SexUcurozadeVeyu</ClassName>

    <ReadOnly>true</ReadOnly>
    <ReadStoredProcedure>Qerat_VedIbenigobuFetox</ReadStoredProcedure>

    <PrimaryKeyAttribute>
        <Attribute columnName="QACEDIMI_PROD_RUM_YAK_P" javaType="int"
                   name="merojuraBo" sqlType="Ciyisag"/>
        <Attribute columnName="BEFACEBAQ_PROD_RUM_YAK_P" javaType="int"
                   name="minedurokIs" sqlType="Ciyisag"/>
        <Attribute columnName="XUWIGA_FEZI_N" javaType="String"
                   name="giqeqeYici" sqlType="XefeTewesa"/>
        <Attribute columnName="BEFACEBAQ_TADE_N" javaType="String"
                   name="tiniyewakUyik" sqlType="XefeTewesa"/>
        <Attribute columnName="DAG_SIBA_Z" javaType="Timestamp" name="nuTeRogi"
                   sqlType="Timestamp"/>
    </PrimaryKeyAttribute>

    <Attribute columnName="PIXISEQAD_M" javaType="double" name="pixiseqad"
               sqlType="Luhisa"/>

    <Relationship name="xujajuneGelasoHexepil" dependentClass="ZuquxuLOQOmawavi"
                  cardinality="many-to-one" foreignKey="joqeticuQikatecEje"
                  useCacheIndexing="true"/>

    <Relationship name="zupoyefudOsocucEvihici"
                  dependentClass="ZuquxuLOQOmawavi" cardinality="many-to-one"
                  foreignKey="wezurapuzIrocilaYos"
                  useCacheIndexing="true"/>

    <Index name="businessDate">businessDate</Index>
    <Index name="cavukodona">minedurokIs</Index>
</ManagedObject>
