<?xml version="1.0" encoding="UTF-8" standalone="yes"?>
<!--
Copyright 2016 Goldman Sachs.
Licensed under the Apache License, Version 2.0 (the "License");
you may not use this file except in compliance with the License.
You may obtain a copy of the License at

  http://www.apache.org/licenses/LICENSE-2.0

Unless required by applicable law or agreed to in writing,
software distributed under the License is distributed on an
"AS IS" BASIS, WITHOUT WARRANTIES OR CONDITIONS OF ANY
KIND, either express or implied.  See the License for the
specific language governing permissions and limitations
under the License.
-->
<ManagedObject xsi:noNamespaceSchemaLocation="../../../xsd/objectmanager.xsd"
               xmlns:xsi="http://www.w3.org/2001/XMLSchema-instance">
    <Templates>noki,wululu,nuzikuzu,key,tetahij</Templates>
    <PackageName>com.gs.fw.lilu.hos.domain.biziliniwof.zeqafopotu</PackageName>
    <ImportPackageName>com.gs.fw.lilu.wute.domain.yoru.Currency
    </ImportPackageName>
    <ImportPackageName>com.gs.fw.lilu.wute.domain.yoru.GifufekeZeb
    </ImportPackageName>
    <ImportPackageName>com.gs.fw.lilu.hos.domain.product.ZuquxuLOQOmawavi
    </ImportPackageName>
    <ClassName>YizihEkizaqediNodi</ClassName>
    <ConnectionManagerName/>
    <ReadOnly>true</ReadOnly>
    <ReadStoredProcedure>Qerat_WulUbiheTakevovamo</ReadStoredProcedure>

    <PrimaryKeyAttribute keyClass="HiqenUcokitedoBuxiHel">
        <Attribute columnName="JOVOY_P" javaType="long" sqlType="Nula"
                   name="sowiwEv"/>
        <Attribute columnName="QACEDIMI_PROD_RUM_YAK_P" javaType="int"
                   sqlType="Ciyisag" name="jusagofoGidogetAh"/>
        <Attribute columnName="BEFACEBAQ_PROD_RUM_YAK_P" javaType="int"
                   sqlType="Ciyisag" name="nigamucupOranemoVi"/>
        <Attribute columnName="businessDate" javaType="Timestamp"
                   sqlType="XIZofuxafasElegexaLimanigaw"
                   name="businessDate"/>
    </PrimaryKeyAttribute>

    <Attribute columnName="FAY_YAK_W" javaType="String" sqlType="XefeTewesa"
               name="ruwehuqiyOrejivata"/>
    <Attribute columnName="KAB_YAK_W" javaType="String" sqlType="XefeTewesa"
               name="huwAmayoduni"/>
    <Attribute columnName="COMPONENT_YAK_W" javaType="String"
               sqlType="XefeTewesa" name="dudawAfisorogiXum"/>
    <Attribute columnName="COMPONENT_NO_Z" javaType="Timestamp"
               sqlType="Timestamp" name="sihofOcerulofuJoQ"/>
    <Attribute columnName="PIXISEQAD_M" javaType="double" sqlType="Luhisa"
               name="pixiseqad"/>
    <Attribute columnName="FAY_XOV_ZOYOJO" javaType="double" sqlType="Luhisa"
               name="tinitiJuqux"/>
    <Attribute columnName="XUWIGA_FEZI_N" javaType="String" sqlType="XefeTewesa"
               name="giqeqeYici"/>

    <ForeignKeyAttribute keyClass="GifufekeZeb" name="xowicagalIqujEfoNit">
        <Attribute columnName="FAY_CIQ_N" javaType="String"
                   sqlType="HorupozoxObuhiriKoyedu" name="name"/>
        <Attribute columnName="businessDate" javaType="Timestamp"
                   sqlType="XIZofuxafasElegexaLimanigaw"
                   name="nuTeRogi"/>
    </ForeignKeyAttribute>

    <Relationship cardinality="many-to-one" dependentClass="Currency"
                  foreignKey="xowicagalIqujEfoNit"
                  name="manuremenUmobUmo" useCacheIndexing="true"/>
    <Relationship cardinality="many-to-one" dependentClass="ZuquxuLOQOmawavi"
                  foreignKey="wezurapuzIrocilaYos"
                  name="zupoyefudOsocucEvihici" useCacheIndexing="true"/>

    <AbstractMethod returnType="yuso" methodName="buxEjuyedomaLerazoxUta"
                    parameters="YowufarutaGib yowufarutaGib"/>
    <AbstractMethod returnType="YowufarutaGib"
                    methodName="fatAbuzacobeGatoboqIko"/>

    <AbstractMethod returnType="yuso" methodName="qenUxiwaMekeqofidOti"
                    parameters="YowufarutaGib yowufarutaGib"/>
    <AbstractMethod returnType="YowufarutaGib"
                    methodName="zoxAjumaWuxuyetuhEbi"/>

    <Index name="bogoxeWo">sowiwEv</Index>
    <Index name="businessDate">businessDate</Index>
    <Index name="miguhOhosoquniLax">miguhOhosoquniLax</Index>
</ManagedObject>
